[
  {
    "id": "skeleton",
    "spriteId": "skeleton",
    "moveSpeed": 2,
    "maxHp": 100,
    "action": {
      "animation": "attack",
      "seekTargetCondition": ["alive", "enemy-team"],
      "distance": 40,
      "cooldown": 120,
      "speed": 30,
      "hitEffect": [{ "type": "dmg", "args": 20 }]
    },
    "size": 32
  },
  {
    "id": "archer",
    "spriteId": "archer",
    "moveSpeed": 2,
    "maxHp": 100,
    "action": {
      "animation": "attack",
      "seekTargetCondition": ["alive", "enemy-team"],
      "projectileId": "projectile",
      "distance": 400,
      "cooldown": 120,
      "speed": 30,
      "projectileSpeed": 5,
      "hitEffect": [{ "type": "dmg", "args": 20 }]
    },
    "size": 32
  },
  {
    "id": "necromancer",
    "spriteId": "inquisitor",
    "moveSpeed": 2,
    "maxHp": 100,
    "action": {
      "animation": "attack",
      "seekTargetCondition": ["dead", "same-team"],
      "distance": 100,
      "cooldown": 500,
      "speed": 60,
      "hitEffect": [{ "type": "revive" }]
    },
    "size": 32
  },
  {
    "id": "priest",
    "spriteId": "inquisitor",
    "moveSpeed": 2,
    "maxHp": 100,
    "action": {
      "animation": "attack",
      "seekTargetCondition": ["alive", "same-team", "damaged"],
      "distance": 100,
      "cooldown": 150,
      "speed": 60,
      "hitEffect": [{ "type": "heal", "args": 20 }]
    },
    "size": 32
  }
]
